### ISSUE TITLE
[Bug] Guest login fails

### ISSUE THREAD

**Issue by doronbehar** [egdels/SambaLite#32]
### Pre-submission Checklist

- [x] I have searched existing issues for duplicates
- [x] I have tested with the latest version of SambaLite
- [x] I have read the documentation and FAQ

### Bug Description

It just won't work.

```
=== SambaLite System Monitor ===
Generated: 2026-07-08 17:01:30

=== SambaLite System Status ===
Last Updated: 2026-07-08 17:01:30

System Health: ✓ HEALTHY
- Dependency Injection: ✓
- Performance Monitoring: ✓
- Cache System: ✓
- Error Handler: ✓


=== Performance Metrics ===
Memory: Memory: 9.9 MB used / 256.0 MB max (3.9% usage)
Device: Device: Google Pixel 9a (Android 16, API 36)
Performance: Performance: 0 operations, avg 0.0ms, total 0.0s

=== Disk Space ===
Internal Storage:
- Used: 29.3 GB / 228.6 GB
- Free: 199.4 GB
External Storage:
- Used: 29.3 GB / 228.6 GB
- Free: 199.4 GB


=== Cache Statistics ===

Open-File Cache:
- Size: 0 B
- Files: 0
- Max Size: 100 MB (evicts to 50 MB)

Thumbnail Cache:
- Size: 0 B
- Thumbnails: 0
- No-Cover Markers: 0
- Max Size: 50 MB (LRU eviction)

Memory Usage:
- Memory Entries: 0
- Disk Size: 198 B
- Valid Entries: 0
- Expired Entries: 0

Cache Performance:
- Total Requests: 18
- Cache Hits: 6
- Cache Misses: 12
- Hit Rate: 33.33%

Operations:
- Put Operations: 6
- Get Operations: 11
- Remove Operations: 6

Errors:
- Total Errors: 1
- Serialization Errors: 0
- Deserialization Errors: 0
- Disk Write Errors: 0
- Disk Read Errors: 1


=== Network Status ===
Network monitoring handled by system ConnectivityManager


=== Error Summary ===
Error Details:
- Total Errors: 9
- Critical Errors: 0
- Network Errors: 2
- SMB Errors: 6
- Recent Entries: 9

Error tracking is active and automatically collecting data.
Errors are categorized by type and severity for better debugging.


=== Sync Activity Log ===
No sync actions recorded yet.


=== Transfer Activity Log ===
No transfer actions recorded yet.


=== Timestamp Preservation Status ===
Tracked files: 0
No sync state data available.
```

### Steps to Reproduce

Create a simple SMB connection... 

### Expected Behavior

Successfully connecting to server and seeing files there - just like `mount.cifs` works from another Linux machine on the same network.

### Actual Behavior

It won't connect.

### Android Version

Android 14 (API 34)

### Device Model

Pixel 

### SambaLite Version

2.5.3

### SMB Server Type

Samba (Linux)

### Error Logs

```text
Not sure what to grep from there...
```

### Additional Context

Scanning the host for available shares won't show anything, and scanning for hosts in general won't find my smb host too...

### Severity

High - Blocks important functionality

**Comment by egdels** [comment]
Hi @doronbehar,

thanks for the report.

Could you please tell me which Samba server version you are using?

Please also check the Samba server logs while trying to connect with SambaLite. The client report does not show the actual reason why the connection fails.

One important note: SambaLite supports SMB2 and SMB3 only. SMB1/CIFS is not supported.

Thanks!

**Comment by doronbehar** [comment]
> Could you please tell me which Samba server version you are using?

`smbd --version` prints `Version 4.23.8`. 

> Please also check the Samba server logs while trying to connect with SambaLite.

No new lines get printed when I try to "test the connection" or list the files in the share.

> SMB1/CIFS is not supported.

If `mount.cifs` works for me from another Linux host on the network, does it mean my server is configured to serve SMB shares only via SMB1 protocol?

**Comment by egdels** [comment]
Hi @doronbehar,

No. mount.cifs supports SMB2 and SMB3 as well, so a successful mount does not imply that your server is using SMB1.

What's more interesting is that Samba does not log anything at all when SambaLite tries to connect. That suggests the connection may not even be reaching smbd.

Could you verify that SambaLite is connecting to the correct IP address and port (445)?

Thanks!

**Comment by egdels** [comment]
You can also check whether the server sees an incoming connection while SambaLite is trying to connect, for example:

sudo ss -tn sport = :445

or

sudo tcpdump -i any port 445

If neither shows any connection attempt, the problem is likely outside Samba itself.

**Comment by doronbehar** [comment]
> `sudo ss -tn sport = :445`

Prints:

```
State                       Recv-Q                       Send-Q                                             Local Address:Port                                              Peer Address:Port
ESTAB                       0                            0                                                  10.100.102.11:445                                              10.100.102.15:52190
ESTAB                       0                            0                                                  10.100.102.11:445                                              10.100.102.15:44028
ESTAB                       0                            131361                                             10.100.102.11:445                                              10.100.102.15:54446
```

That 10.100.102.15 IP address belongs to the other Linux host that is capable of connecting to the SMB host and `mount.cifs` the files there.

**Comment by egdels** [comment]
Hi @doronbehar,

Thanks, that's very helpful.

The output only shows connections from your other Linux machine (10.100.102.15). I don't see any connection from your Android device.

Could you run tcpdump while pressing Test Connection in SambaLite and check whether any packets from your Android device reach port 445?

Is there a firewall enabled on your server (or elsewhere in the network) that could block connections from your Android device?

Thanks!

**Comment by doronbehar** [comment]
> sudo tcpdump -i any port 445

Gives:

```
tcpdump: WARNING: any: That device doesn't support promiscuous mode
(Promiscuous mode not supported on the "any" device)
tcpdump: verbose output suppressed, use -v[v]... for full protocol decode
listening on any, link-type LINUX_SLL2 (Linux cooked v2), snapshot length 262144 bytes
18:36:29.343460 wlo1  In  IP Android_OPEXZMY2.local.40412 > ZENIX.microsoft-ds: Flags [S], seq 1605143873, win 65535, options [mss 1460,sackOK,TS val 2391813756 ecr 0,nop,wscale 8], length 0
18:36:29.343548 wlo1  Out IP ZENIX.microsoft-ds > Android_OPEXZMY2.local.40412: Flags [S.], seq 2023692972, ack 1605143874, win 65160, options [mss 1460,sackOK,TS val 1029721172 ecr 2391813756,nop,wscale 10], length 0
18:36:29.453208 wlo1  In  IP Android_OPEXZMY2.local.40412 > ZENIX.microsoft-ds: Flags [.], ack 1, win 256, options [nop,nop,TS val 2391814033 ecr 1029721172], length 0
18:36:29.458667 wlo1  In  IP Android_OPEXZMY2.local.40412 > ZENIX.microsoft-ds: Flags [P.], seq 1:163, ack 1, win 256, options [nop,nop,TS val 2391814040 ecr 1029721172], length 162
18:36:29.458760 wlo1  Out IP ZENIX.microsoft-ds > Android_OPEXZMY2.local.40412: Flags [.], ack 163, win 64, options [nop,nop,TS val 1029721288 ecr 2391814040], length 0
18:36:29.470284 wlo1  Out IP ZENIX.microsoft-ds > Android_OPEXZMY2.local.40412: Flags [P.], seq 1:259, ack 163, win 64, options [nop,nop,TS val 1029721299 ecr 2391814040], length 258
18:36:29.476572 wlo1  In  IP Android_OPEXZMY2.local.40412 > ZENIX.microsoft-ds: Flags [.], ack 259, win 261, options [nop,nop,TS val 2391814058 ecr 1029721299], length 0
18:36:29.482581 wlo1  In  IP Android_OPEXZMY2.local.40412 > ZENIX.microsoft-ds: Flags [P.], seq 163:329, ack 259, win 261, options [nop,nop,TS val 2391814065 ecr 1029721299], length 166
18:36:29.483392 wlo1  Out IP ZENIX.microsoft-ds > Android_OPEXZMY2.local.40412: Flags [P.], seq 259:494, ack 329, win 64, options [nop,nop,TS val 1029721312 ecr 2391814065], length 235
18:36:29.494786 wlo1  In  IP Android_OPEXZMY2.local.40412 > ZENIX.microsoft-ds: Flags [P.], seq 329:713, ack 494, win 265, options [nop,nop,TS val 2391814076 ecr 1029721312], length 384
18:36:29.495493 wlo1  Out IP ZENIX.microsoft-ds > Android_OPEXZMY2.local.40412: Flags [P.], seq 494:571, ack 713, win 64, options [nop,nop,TS val 1029721324 ecr 2391814076], length 77
18:36:29.502843 wlo1  In  IP Android_OPEXZMY2.local.40412 > ZENIX.microsoft-ds: Flags [F.], seq 713, ack 571, win 265, options [nop,nop,TS val 2391814083 ecr 1029721324], length 0
18:36:29.503105 wlo1  Out IP ZENIX.microsoft-ds > Android_OPEXZMY2.local.40412: Flags [F.], seq 571, ack 714, win 64, options [nop,nop,TS val 1029721332 ecr 2391814083], length 0
18:36:29.510617 wlo1  In  IP Android_OPEXZMY2.local.40412 > ZENIX.microsoft-ds: Flags [.], ack 572, win 265, options [nop,nop,TS val 2391814091 ecr 1029721332], length 0
```

> Is there a firewall enabled on your server

Clearly no, since that other Linux host connects to it successfully.

**Comment by egdels** [comment]
Hi @doronbehar,

Thanks, the tcpdump output shows that the TCP connection does reach the server.

Could you temporarily increase Samba logging and try again?

For example, in smb.conf:

[global]
    log level = 3 auth:5 passdb:5
    logging = file
    log file = /var/log/samba/log.%m
    max log size = 0

Then restart Samba, try the connection again from SambaLite, and check the newly written log file for the Android client.

Please revert the log level afterwards, since this can produce a lot of output.

Thanks!

**Comment by doronbehar** [comment]
Here you go:

```
[2026/07/08 19:42:44.029794,  3] ../../source3/smbd/smb2_oplock.c:1491(init_oplocks)
  init_oplocks: initializing messages.
[2026/07/08 19:42:44.030727,  3] ../../source3/smbd/smb2_negprot.c:368(smbd_smb2_request_process_negprot)
  Selected protocol SMB3_11
[2026/07/08 19:42:44.030939,  5] ../../source3/auth/auth.c:575(make_auth3_context_for_ntlm)
  make_auth3_context_for_ntlm: Making default auth method list for server role = 'standalone server', encrypt passwords = yes
[2026/07/08 19:42:44.031000,  5] ../../source3/auth/auth.c:52(smb_register_auth)
  Attempting to register auth backend anonymous
[2026/07/08 19:42:44.031044,  5] ../../source3/auth/auth.c:64(smb_register_auth)
  Successfully added auth method 'anonymous'
[2026/07/08 19:42:44.031073,  5] ../../source3/auth/auth.c:52(smb_register_auth)
  Attempting to register auth backend sam
[2026/07/08 19:42:44.031096,  5] ../../source3/auth/auth.c:64(smb_register_auth)
  Successfully added auth method 'sam'
[2026/07/08 19:42:44.031118,  5] ../../source3/auth/auth.c:52(smb_register_auth)
  Attempting to register auth backend sam_ignoredomain
[2026/07/08 19:42:44.031141,  5] ../../source3/auth/auth.c:64(smb_register_auth)
  Successfully added auth method 'sam_ignoredomain'
[2026/07/08 19:42:44.031162,  5] ../../source3/auth/auth.c:52(smb_register_auth)
  Attempting to register auth backend sam_netlogon3
[2026/07/08 19:42:44.031221,  5] ../../source3/auth/auth.c:64(smb_register_auth)
  Successfully added auth method 'sam_netlogon3'
[2026/07/08 19:42:44.031247,  5] ../../source3/auth/auth.c:52(smb_register_auth)
  Attempting to register auth backend winbind
[2026/07/08 19:42:44.031271,  5] ../../source3/auth/auth.c:64(smb_register_auth)
  Successfully added auth method 'winbind'
[2026/07/08 19:42:44.031293,  5] ../../source3/auth/auth.c:436(load_auth_module)
  load_auth_module: Attempting to find an auth method to match anonymous
[2026/07/08 19:42:44.031329,  5] ../../source3/auth/auth.c:461(load_auth_module)
  load_auth_module: auth method anonymous has a valid init
[2026/07/08 19:42:44.031356,  5] ../../source3/auth/auth.c:436(load_auth_module)
  load_auth_module: Attempting to find an auth method to match sam_ignoredomain
[2026/07/08 19:42:44.031379,  5] ../../source3/auth/auth.c:461(load_auth_module)
  load_auth_module: auth method sam_ignoredomain has a valid init
[2026/07/08 19:42:44.033413,  3] ../../auth/gensec/gensec_start.c:1052(gensec_register)
  GENSEC backend 'gssapi_spnego' registered
[2026/07/08 19:42:44.033481,  3] ../../auth/gensec/gensec_start.c:1052(gensec_register)
  GENSEC backend 'gssapi_krb5' registered
[2026/07/08 19:42:44.033514,  3] ../../auth/gensec/gensec_start.c:1052(gensec_register)
  GENSEC backend 'gssapi_krb5_sasl' registered
[2026/07/08 19:42:44.033546,  3] ../../auth/gensec/gensec_start.c:1052(gensec_register)
  GENSEC backend 'spnego' registered
[2026/07/08 19:42:44.033572,  3] ../../auth/gensec/gensec_start.c:1052(gensec_register)
  GENSEC backend 'schannel' registered
[2026/07/08 19:42:44.033596,  3] ../../auth/gensec/gensec_start.c:1052(gensec_register)
  GENSEC backend 'ncalrpc_as_system' registered
[2026/07/08 19:42:44.033632,  3] ../../auth/gensec/gensec_start.c:1052(gensec_register)
  GENSEC backend 'sasl-EXTERNAL' registered
[2026/07/08 19:42:44.033661,  3] ../../auth/gensec/gensec_start.c:1052(gensec_register)
  GENSEC backend 'ntlmssp' registered
[2026/07/08 19:42:44.033684,  3] ../../auth/gensec/gensec_start.c:1052(gensec_register)
  GENSEC backend 'ntlmssp_resume_ccache' registered
[2026/07/08 19:42:44.033708,  3] ../../auth/gensec/gensec_start.c:1052(gensec_register)
  GENSEC backend 'http_basic' registered
[2026/07/08 19:42:44.033731,  3] ../../auth/gensec/gensec_start.c:1052(gensec_register)
  GENSEC backend 'http_ntlm' registered
[2026/07/08 19:42:44.033754,  3] ../../auth/gensec/gensec_start.c:1052(gensec_register)
  GENSEC backend 'http_negotiate' registered
[2026/07/08 19:42:44.033953,  5] ../../auth/gensec/gensec_start.c:813(gensec_start_mech)
  Starting GENSEC mechanism spnego
[2026/07/08 19:42:44.034051,  5] ../../auth/gensec/gensec_start.c:813(gensec_start_mech)
  Starting GENSEC submechanism ntlmssp
[2026/07/08 19:42:44.044624,  5] ../../source3/auth/auth.c:575(make_auth3_context_for_ntlm)
  make_auth3_context_for_ntlm: Making default auth method list for server role = 'standalone server', encrypt passwords = yes
[2026/07/08 19:42:44.044723,  5] ../../source3/auth/auth.c:436(load_auth_module)
  load_auth_module: Attempting to find an auth method to match anonymous
[2026/07/08 19:42:44.044760,  5] ../../source3/auth/auth.c:461(load_auth_module)
  load_auth_module: auth method anonymous has a valid init
[2026/07/08 19:42:44.044785,  5] ../../source3/auth/auth.c:436(load_auth_module)
  load_auth_module: Attempting to find an auth method to match sam_ignoredomain
[2026/07/08 19:42:44.044809,  5] ../../source3/auth/auth.c:461(load_auth_module)
  load_auth_module: auth method sam_ignoredomain has a valid init
[2026/07/08 19:42:44.044936,  5] ../../auth/gensec/gensec_start.c:813(gensec_start_mech)
  Starting GENSEC mechanism spnego
[2026/07/08 19:42:44.045113,  5] ../../auth/gensec/gensec_start.c:813(gensec_start_mech)
  Starting GENSEC submechanism ntlmssp
[2026/07/08 19:42:44.045216,  3] ../../auth/ntlmssp/ntlmssp_util.c:78(debug_ntlmssp_flags)
  Got NTLMSSP neg_flags=0x62088215
    NTLMSSP_NEGOTIATE_UNICODE
    NTLMSSP_REQUEST_TARGET
    NTLMSSP_NEGOTIATE_SIGN
    NTLMSSP_NEGOTIATE_NTLM
    NTLMSSP_NEGOTIATE_ALWAYS_SIGN
    NTLMSSP_NEGOTIATE_EXTENDED_SESSIONSECURITY
    NTLMSSP_NEGOTIATE_VERSION
    NTLMSSP_NEGOTIATE_128
    NTLMSSP_NEGOTIATE_KEY_EXCH
[2026/07/08 19:42:44.061550,  3] ../../auth/ntlmssp/ntlmssp_server.c:506(ntlmssp_server_preauth)
  Got user=[Guest] domain=[] workstation=[] len1=0 len2=142
[2026/07/08 19:42:44.061729,  5] ../../source3/auth/auth_util.c:125(make_user_info_map)
  Mapping user []\[Guest] from workstation []
[2026/07/08 19:42:44.061771,  5] ../../source3/auth/user_info.c:64(make_user_info)
  attempting to make a user_info for Guest (Guest)
[2026/07/08 19:42:44.061797,  5] ../../source3/auth/user_info.c:72(make_user_info)
  making strings for Guest's user_info struct
[2026/07/08 19:42:44.061825,  5] ../../source3/auth/user_info.c:117(make_user_info)
  making blobs for Guest's user_info struct
[2026/07/08 19:42:44.061853,  3] ../../source3/auth/auth.c:202(auth_check_ntlm_password)
  auth_check_ntlm_password: check_ntlm_password:  Checking password for unmapped user []\[Guest]@[] with the new password interface
[2026/07/08 19:42:44.061879,  3] ../../source3/auth/auth.c:208(auth_check_ntlm_password)
  auth_check_ntlm_password: check_ntlm_password:  mapped user is: []\[Guest]@[]
[2026/07/08 19:42:44.061981,  5] ../../source3/passdb/pdb_tdb.c:602(tdbsam_getsampwnam)
  pdb_getsampwnam (TDB): error fetching database.
   Key: USER_guest
[2026/07/08 19:42:44.062040,  3] ../../source3/auth/check_samsec.c:408(check_sam_security)
  check_sam_security: Couldn't find user 'Guest' in passdb.
[2026/07/08 19:42:44.062069,  5] ../../source3/auth/auth.c:265(auth_check_ntlm_password)
  auth_check_ntlm_password: sam_ignoredomain authentication for user [Guest] FAILED with error NT_STATUS_NO_SUCH_USER, authoritative=1
[2026/07/08 19:42:44.062125,  2] ../../source3/auth/auth.c:353(auth_check_ntlm_password)
  check_ntlm_password:  Authentication for user [Guest] -> [Guest] FAILED with error NT_STATUS_NO_SUCH_USER, authoritative=1
[2026/07/08 19:42:44.062244,  2] ../../auth/auth_log.c:860(log_authentication_event_human_readable)
  Auth: [SMB2,(null)] user []\[Guest] at [Wed, 08 Jul 2026 19:42:44.062168 IDT] with [NTLMv2] status [NT_STATUS_NO_SUCH_USER] workstation [] remote host [ipv4:10.100.102.12:52094] mapped to []\[Guest]. local host [ipv4:10.100.102.11:445] 
  {"timestamp": "2026-07-08T19:42:44.062442+0300", "type": "Authentication", "Authentication": {"version": {"major": 1, "minor": 3}, "eventId": 4625, "logonId": "0", "logonType": 3, "status": "NT_STATUS_NO_SUCH_USER", "localAddress": "ipv4:10.100.102.11:445", "remoteAddress": "ipv4:10.100.102.12:52094", "serviceDescription": "SMB2", "authDescription": null, "clientDomain": "", "clientAccount": "Guest", "workstation": "", "becameAccount": null, "becameDomain": null, "becameSid": null, "mappedAccount": "Guest", "mappedDomain": "", "netlogonComputer": null, "netlogonTrustAccount": null, "netlogonNegotiateFlags": "0x00000000", "netlogonSecureChannelType": 0, "netlogonTrustAccountSid": null, "passwordType": "NTLMv2", "clientPolicyAccessCheck": null, "serverPolicyAccessCheck": null, "duration": 17746}}
[2026/07/08 19:42:44.062625,  5] ../../auth/ntlmssp/ntlmssp_server.c:861(ntlmssp_server_auth_done)
  ntlmssp_server_auth_done: Checking NTLMSSP password for \Guest failed: NT_STATUS_NO_SUCH_USER
[2026/07/08 19:42:44.062696,  5] ../../auth/gensec/gensec.c:536(gensec_update_done)
  gensec_update_done: ntlmssp[0x63138a2c69d0]: NT_STATUS_NO_SUCH_USER
[2026/07/08 19:42:44.062731,  3] ../../auth/gensec/spnego.c:1426(gensec_spnego_server_negTokenTarg_step)
  gensec_spnego_server_negTokenTarg_step: SPNEGO(ntlmssp) login failed: NT_STATUS_NO_SUCH_USER
[2026/07/08 19:42:44.062762,  5] ../../auth/gensec/gensec.c:536(gensec_update_done)
  gensec_update_done: spnego[0x63138a2c5a50]: NT_STATUS_NO_SUCH_USER
[2026/07/08 19:42:44.062853,  3] ../../source3/smbd/smb2_server.c:4151(smbd_smb2_request_error_ex)
  smbd_smb2_request_error_ex: idx[1] status[NT_STATUS_LOGON_FAILURE] || at ../../source3/smbd/smb2_sesssetup.c:149
[2026/07/08 19:42:44.069796,  3] ../../source3/smbd/server_exit.c:230(exit_server_common)
  Server exit (NT_STATUS_CONNECTION_RESET)
```

**Comment by doronbehar** [comment]
BTW The way it works for me on that other Linux host with `mount.cifs`, is with `-o ro,guest,noperm`.

**Comment by egdels** [comment]
Hi @doronbehar,

It looks like there may be an issue with guest access. I'll need to take a closer look at it.

In the meantime, could you try connecting with a regular Samba user instead of guest access?

Thanks for reporting the issue!

**Comment by doronbehar** [comment]
I managed to connect to the samba host after I ran `sudo smbpasswd -a doron` and set a password etc. (It wasn't that hard!). Still it'd be nice if guest login wouldn't have failed :). Thanks for your prompt replies and support.

**Comment by egdels** [comment]
Hi @doronbehar,

I found the cause.

SambaLite used SMBJ's `AuthenticationContext.guest()` when both username and password were empty. However, this sends the username `Guest`, which explains the Samba log entry:

`Got user=[Guest]`

This only works if the server maps unknown users to the guest account, for example with `map to guest = Bad User`.

I tested using an anonymous authentication context instead, and that works:

`new AuthenticationContext(null, new char[0], domain)`

So this should behave much closer to `mount.cifs -o guest`.

Guest access should also work for you if you adjust your Samba configuration accordingly:

[https://egdels.github.io/SambaLite/faq.html](https://egdels.github.io/SambaLite/faq.html)

Thanks again for the detailed logs. They made the issue very clear.

**Comment by doronbehar** [comment]
> This only works if the server maps unknown users to the guest account, for example with `map to guest = Bad User`.
> 
> I tested using an anonymous authentication context instead, and that works:
> 
> `new AuthenticationContext(null, new char[0], domain)`

So this will be updated in the next release? Or is it still "the server's fault"? Here's the `smb.conf` I have on this server:

```
[global]
invalid users=root
logging=systemd
passwd program=/run/wrappers/bin/passwd %u
security=user
[Music]
browseable=yes
guest ok=yes
path=/var/lib/mpd/music
read only=true
```

**Comment by egdels** [comment]
Hi @doronbehar,

I'll fix this in the next SambaLite release.

In the meantime, you can make the current version work by adding

map to guest = Bad User

to your Samba configuration.

**Comment by egdels** [comment]
Hi @doronbehar Plz see: https://github.com/egdels/SambaLite/releases/tag/v2.5.4

**Comment by doronbehar** [comment]
Worked ,thanks!

**Comment by kugel-** [comment]
I'm new to sambalite so I'm unsure if it's a regression or not, but in the last release I cannot connect to a windows 11 share without credentials. After finding about this issue I tried "guest" as username and only then I could connect.
